{"assets":[{"byte_length":92696,"media_type":"image/jpeg","path":"media/prototype-whole.jpg","purpose":"README_DOCUMENTATION","rights_ref":"local-render/P0013/plan-view/v1","rights_status":"PUBLIC_CLEARED","sha256":"sha256:adf0cb621b9c49a5962371dea5163cdd0a66bda8ee5212eba26fb4de276086e5"}],"contract_version":"project-supplemental-public-media/v1","record_id":"P0013","source":{"basis":"existing-public-record","commit":"c44222a77267f9a6250d900f2b7d73246f5886a3","locator":"plans/P0013-auto-auto-plan-20260916t125851z-rev4","repository":"agentic-art-project"}}
