{"assets":[{"byte_length":3809,"media_type":"image/svg+xml","path":"media/prototype/simulated-prototype-preview.svg","purpose":"README_DOCUMENTATION","rights_ref":"public-plan-supplement/P0002/simulated-preview/v1","rights_status":"PUBLIC_CLEARED","sha256":"sha256:a7afdfcdc9c3c0eb300735ff83fb41f0a0fa5fa092048253e8d2e3f6624a02df"}],"contract_version":"project-supplemental-public-media/v1","record_id":"P0002","source":{"basis":"existing-public-record","commit":"3c403e2a2e5938a5d2c7ae055d7e241de961c3ce","locator":"plans/P0002-moving-gap","repository":"agentic-art-project"}}
