{"assets":[{"byte_length":102761,"media_type":"image/jpeg","path":"media/prototype-whole.jpg","purpose":"README_DOCUMENTATION","rights_ref":"codex-image-generation/P0018/plan-view/v1","rights_status":"PUBLIC_CLEARED","sha256":"sha256:1dbc527c3ef045d7be369ba87b53b352e3d9cafb4a68bf2079fef27bc0f36375"}],"contract_version":"project-supplemental-public-media/v1","record_id":"P0018","source":{"basis":"existing-public-record","commit":"03f7472779179d39caf1af31863f8a1404295662","locator":"plans/P0018-pointillist-swatches-and-reserve-budget","repository":"agentic-art-project"}}
