{"assets":[{"byte_length":55865,"media_type":"image/jpeg","path":"media/prototype-detail.jpg","purpose":"README_DOCUMENTATION","rights_ref":"local-render/P0001/three-panel-translation-room/v1","rights_status":"PUBLIC_CLEARED","sha256":"sha256:cce50a6a5becaf47fcd7d896078fd2b439e7e1b2a7d34a7bd02496184ec916f4"},{"byte_length":65544,"media_type":"image/jpeg","path":"media/prototype-whole.jpg","purpose":"README_DOCUMENTATION","rights_ref":"local-render/P0001/three-panel-translation-room/v1","rights_status":"PUBLIC_CLEARED","sha256":"sha256:c2b66fbae24540f766d14e29dffb76a64a3cefb2cd47991e386ae00ed87b7f98"},{"byte_length":2951,"media_type":"image/svg+xml","path":"media/prototype/simulated-prototype-preview.svg","purpose":"README_DOCUMENTATION","rights_ref":"public-plan-supplement/P0001/simulated-preview/v1","rights_status":"PUBLIC_CLEARED","sha256":"sha256:52738c898669ab587f790c709e0edc8c310554c6b38a5dccc91601faebdebc80"}],"contract_version":"project-supplemental-public-media/v1","record_id":"P0001","source":{"basis":"existing-public-record","commit":"3c403e2a2e5938a5d2c7ae055d7e241de961c3ce","locator":"plans/P0001-owner-of-choice","repository":"agentic-art-project"}}
