{"assets":[{"byte_length":185628,"media_type":"image/jpeg","path":"media/prototype-whole.jpg","purpose":"README_DOCUMENTATION","rights_ref":"local-render/P0003/plan-view/v1","rights_status":"PUBLIC_CLEARED","sha256":"sha256:d4af822a72788d4c8815f5530133620ae6e8bfb42370cf2520a7e6027f21e700"},{"byte_length":3560,"media_type":"image/svg+xml","path":"media/prototype/simulated-prototype-preview.svg","purpose":"README_DOCUMENTATION","rights_ref":"public-plan-supplement/P0003/simulated-preview/v1","rights_status":"PUBLIC_CLEARED","sha256":"sha256:7b9215121ca317f44fd40c547f39e169004f7acdc5f15102a349b1a0028e45be"}],"contract_version":"project-supplemental-public-media/v1","record_id":"P0003","source":{"basis":"existing-public-record","commit":"3c403e2a2e5938a5d2c7ae055d7e241de961c3ce","locator":"plans/P0003-yohaku-breath","repository":"agentic-art-project"}}
