{"assets":[{"byte_length":125449,"media_type":"image/jpeg","path":"media/prototype-whole.jpg","purpose":"README_DOCUMENTATION","rights_ref":"local-render/P0015/plan-view/v1","rights_status":"PUBLIC_CLEARED","sha256":"sha256:f7bcce69411f007c1ba1229bc3b3c96c1f72d5a1345a6fa3c5d64ad29fb16a3d"},{"byte_length":2688,"media_type":"image/svg+xml","path":"media/prototype/simulated-prototype-preview.svg","purpose":"README_DOCUMENTATION","rights_ref":"public-plan-supplement/P0015/simulated-preview/v1","rights_status":"PUBLIC_CLEARED","sha256":"sha256:0b45da2fa16eb5304daaa336ae4f1e58091837f61947b937a17b70b1ab40b6ae"}],"contract_version":"project-supplemental-public-media/v1","record_id":"P0015","source":{"basis":"existing-public-record","commit":"3c403e2a2e5938a5d2c7ae055d7e241de961c3ce","locator":"plans/P0015-review-threshold-as-a-reversible-installation","repository":"agentic-art-project"}}
