{"assets":[{"byte_length":103384,"media_type":"image/jpeg","path":"media/prototype-whole.jpg","purpose":"README_DOCUMENTATION","rights_ref":"local-render/P0007/plan-view/v1","rights_status":"PUBLIC_CLEARED","sha256":"sha256:b03913ae6a406fabac964d1a9b775ca19df13737ff71b55e5a6ed4b502aed1ce"},{"byte_length":6062,"media_type":"image/svg+xml","path":"media/prototype/simulated-prototype-preview.svg","purpose":"README_DOCUMENTATION","rights_ref":"public-plan-supplement/P0007/simulated-preview/v1","rights_status":"PUBLIC_CLEARED","sha256":"sha256:7dc2bffe1e2bd8ad882742f4a3706dfda79d232871aa082e30eea4e5299369df"}],"contract_version":"project-supplemental-public-media/v1","record_id":"P0007","source":{"basis":"existing-public-record","commit":"3c403e2a2e5938a5d2c7ae055d7e241de961c3ce","locator":"plans/P0007-near-not-received","repository":"agentic-art-project"}}
