{"assets":[{"byte_length":48088,"media_type":"image/jpeg","path":"media/prototype-whole.jpg","purpose":"README_DOCUMENTATION","rights_ref":"local-render/P0010/plan-view/v1","rights_status":"PUBLIC_CLEARED","sha256":"sha256:37511702ec76f143eeace6e29b019402800d3b64a3c4c571e82d7a29bfa3a7c6"}],"contract_version":"project-supplemental-public-media/v1","record_id":"P0010","source":{"basis":"existing-public-record","commit":"c44222a77267f9a6250d900f2b7d73246f5886a3","locator":"plans/P0010-backfill-gap-0010","repository":"agentic-art-project"}}
