{"assets":[{"byte_length":47320,"media_type":"image/jpeg","path":"media/prototype-whole.jpg","purpose":"README_DOCUMENTATION","rights_ref":"local-render/P0017/plan-view/v1","rights_status":"PUBLIC_CLEARED","sha256":"sha256:2f841f1d1e8185df17ff60739d2d723ff4f6e5c8b82fc55f6ef5f61852ccac91"}],"contract_version":"project-supplemental-public-media/v1","record_id":"P0017","source":{"basis":"existing-public-record","commit":"c44222a77267f9a6250d900f2b7d73246f5886a3","locator":"plans/P0017-receiving-interval","repository":"agentic-art-project"}}
