{"assets":[{"byte_length":151322,"media_type":"image/jpeg","path":"media/prototype-whole.jpg","purpose":"README_DOCUMENTATION","rights_ref":"local-render/P0009/plan-view/v1","rights_status":"PUBLIC_CLEARED","sha256":"sha256:c57f04660faa7da89d262530de2d6509dbf2331d8ebb612e13815ee313ec325d"},{"byte_length":3246,"media_type":"image/svg+xml","path":"media/prototype/simulated-prototype-preview.svg","purpose":"README_DOCUMENTATION","rights_ref":"public-plan-supplement/P0009/simulated-preview/v1","rights_status":"PUBLIC_CLEARED","sha256":"sha256:5138db82eeb686772c751916e4dc9e71bc481cf884dee6ae4468e4380bc7213e"}],"contract_version":"project-supplemental-public-media/v1","record_id":"P0009","source":{"basis":"existing-public-record","commit":"3c403e2a2e5938a5d2c7ae055d7e241de961c3ce","locator":"plans/P0009-external-possession","repository":"agentic-art-project"}}
