{"assets":[{"byte_length":614119,"media_type":"image/jpeg","path":"media/sample-detail.jpg","purpose":"README_DOCUMENTATION","rights_ref":"existing-public-record/P0004#PR32","rights_status":"PUBLIC_CLEARED","sha256":"sha256:8dc0ee8a185524257d2e7782d3232e7439b74a4739b6859a78de47df7a207abe"},{"byte_length":609175,"media_type":"image/jpeg","path":"media/sample-whole.jpg","purpose":"README_DOCUMENTATION","rights_ref":"existing-public-record/P0004#PR32","rights_status":"PUBLIC_CLEARED","sha256":"sha256:ff704d497509c8cdab2a7c4badeaee74a6977cac94b2dcd04efea0e2ce847e04"}],"contract_version":"project-supplemental-public-media/v1","record_id":"P0004","source":{"basis":"existing-public-record","commit":"9421b0019ea84064c5e6828bebd3b8edebee4e0a","locator":"plans/P0004-necessary-retreat","repository":"agentic-art-project"}}
