{"assets":[{"byte_length":97662,"media_type":"image/jpeg","path":"media/prototype-whole.jpg","purpose":"README_DOCUMENTATION","rights_ref":"local-render/P0008/plan-view/v1","rights_status":"PUBLIC_CLEARED","sha256":"sha256:bb824dd2c84e9942467938f48e7be58ced2d25ddb317a0e2ed03508ad4eca0f1"},{"byte_length":3043,"media_type":"image/svg+xml","path":"media/prototype/simulated-prototype-preview.svg","purpose":"README_DOCUMENTATION","rights_ref":"public-plan-supplement/P0008/simulated-preview/v1","rights_status":"PUBLIC_CLEARED","sha256":"sha256:3975e7843137e5334d9c297ced95bd81a1d4427721894f476c3a2e672e56d622"}],"contract_version":"project-supplemental-public-media/v1","record_id":"P0008","source":{"basis":"existing-public-record","commit":"3c403e2a2e5938a5d2c7ae055d7e241de961c3ce","locator":"plans/P0008-interrupted-interval-installation","repository":"agentic-art-project"}}
