{"assets":[{"byte_length":83668,"media_type":"image/jpeg","path":"media/prototype-whole.jpg","purpose":"README_DOCUMENTATION","rights_ref":"local-render/P0006/plan-view/v1","rights_status":"PUBLIC_CLEARED","sha256":"sha256:85995d5a1f1f0d995fc979c9906f04ec507295a68722b79a29735ef490df3eaa"},{"byte_length":3184,"media_type":"image/svg+xml","path":"media/prototype/simulated-prototype-preview.svg","purpose":"README_DOCUMENTATION","rights_ref":"public-plan-supplement/P0006/simulated-preview/v1","rights_status":"PUBLIC_CLEARED","sha256":"sha256:a9bf38f3b04e8e09ab7fc5a6ba9b80e83a4682a5ae0c3bc3609e5a28c69b409d"}],"contract_version":"project-supplemental-public-media/v1","record_id":"P0006","source":{"basis":"existing-public-record","commit":"3c403e2a2e5938a5d2c7ae055d7e241de961c3ce","locator":"plans/P0006-distance-selects-boundary","repository":"agentic-art-project"}}
