{"assets":[{"byte_length":188106,"media_type":"image/jpeg","path":"media/prototype-whole.jpg","purpose":"README_DOCUMENTATION","rights_ref":"codex-image-generation/P0019/plan-view/v1","rights_status":"PUBLIC_CLEARED","sha256":"sha256:6a76364f9c1d41e4c48ef553a89202eea395cb5d435c3427134787bf8760737b"}],"contract_version":"project-supplemental-public-media/v1","record_id":"P0019","source":{"basis":"existing-public-record","commit":"dcad46f99c42d54b9566fb9aaca3db8b088629ce","locator":"plans/P0019-white-wood-wall-three-color-instructions","repository":"agentic-art-project"}}
