{"assets":[{"byte_length":2678,"media_type":"image/svg+xml","path":"media/prototype/simulated-prototype-preview.svg","purpose":"README_DOCUMENTATION","rights_ref":"public-plan-supplement/P0005/simulated-preview/v1","rights_status":"PUBLIC_CLEARED","sha256":"sha256:0c5f08faed2954c345b305a784a142c1a670cef69965fec779a86c591efcb122"}],"contract_version":"project-supplemental-public-media/v1","record_id":"P0005","source":{"basis":"existing-public-record","commit":"3c403e2a2e5938a5d2c7ae055d7e241de961c3ce","locator":"plans/P0005-close-but-cannot-reach","repository":"agentic-art-project"}}
